{
  "tiers": ["main", "router"],
  "default_tier": "main",
  "model_config": {
    "main_config": {
      "purpose": "内容生成主挡位（默认回落目标）",
      "requires_user_config": true
    },
    "router_config": {
      "purpose": "路由/蒸馏等轻量决策（省成本）；配置缺失回落 main_config",
      "requires_user_config": true
    }
  },
  "fallback": {
    "unknown_tier_falls_to": "main",
    "missing_tier_config_falls_to": "main_config",
    "note": "与引擎 tiers 语义对齐：tier_key 未知回落 main；resolve_tier_config 缺挡位配置回落 main_config；实际连接配置（base_url/模型/密钥引用）由宿主注入，归宿主职责"
  }
}
